{"schemaVersion":1,"workId":"OL1793164W","title":"Three Men in a Boat (to say nothing of the dog)","authors":["Jerome Klapka Jérôme"],"firstPublished":1889,"edition":{"description":"Sections as detected in Project Gutenberg eBook #308.","source":"Project Gutenberg eBook #308","url":"https://www.gutenberg.org/ebooks/308"},"sectionLabel":{"singular":"Chapter","plural":"Chapters"},"sections":[{"id":"s1","label":"Ch. 1","title":"Three invalids.—Sufferings of George and Harris.—A victim to one"},{"id":"s2","label":"Ch. 2"},{"id":"s3","label":"Ch. 3"},{"id":"s4","label":"Ch. 4","title":"The food question.—Objections to paraffine oil as an"},{"id":"s5","label":"Ch. 5","title":"Mrs. P. arouses us.—George, the sluggard.—The “weather forecast”"},{"id":"s6","label":"Ch. 6","title":"Kingston.—Instructive remarks on early English history.—Instructive"},{"id":"s7","label":"Ch. 7","title":"The river in its Sunday garb.—Dress on the river.—A chance for the"},{"id":"s8","label":"Ch. 8","title":"Blackmailing.—The proper course to pursue.—Selfish boorishness of"},{"id":"s9","label":"Ch. 9","title":"George is introduced to work.—Heathenish instincts of"},{"id":"s10","label":"Ch. 10","title":"Our first night.—Under canvas.—An appeal for help.—Contrariness of"},{"id":"s11","label":"Ch. 11"},{"id":"s12","label":"Ch. 12","title":"Henry VIII. and Anne Boleyn.—Disadvantages of living in same house"},{"id":"s13","label":"Ch. 13","title":"Marlow.—Bisham Abbey.—The Medmenham Monks.—Montmorency thinks he"},{"id":"s14","label":"Ch. 14","title":"Wargrave.—Waxworks.—Sonning.—Our stew.—Montmorency is"},{"id":"s15","label":"Ch. 15","title":"Household duties.—Love of work.—The old river hand, what he"},{"id":"s16","label":"Ch. 16","title":"Reading.—We are towed by steam launch.—Irritating behaviour of small"},{"id":"s17","label":"Ch. 17","title":"Washing day.—Fish and fishers.—On the art of angling.—A conscientious"},{"id":"s18","label":"Ch. 18","title":"Locks.—George and I are"},{"id":"s19","label":"Ch. 19"}],"characters":[{"id":"george","name":"George","role":"protagonist","firstAppearance":"s1","summary":"First mention: “Three invalids.—Sufferings of George and Harris.—A victim to one hundred and seven fatal maladies.—Useful prescriptions.—Cure for liver complaint in children.—We agree that we are overworked, and need rest.—A week on…”"},{"id":"harris","name":"Harris","role":"protagonist","firstAppearance":"s1","summary":"First mention: “Three invalids.—Sufferings of George and Harris.—A victim to one hundred and seven fatal maladies.—Useful prescriptions.—Cure for liver complaint in children.—We agree that we are overworked, and need rest.—A week on…”"},{"id":"montmorency","name":"Montmorency","role":"supporting","firstAppearance":"s1","summary":"First mention: “Three invalids.—Sufferings of George and Harris.—A victim to one hundred and seven fatal maladies.—Useful prescriptions.—Cure for liver complaint in children.—We agree that we are overworked, and need rest.—A week on…”"},{"id":"tom","name":"Tom","role":"minor","firstAppearance":"s3","summary":"First mention: “[Picture: Candle] “Now you go and get me my hammer, Will,” he would shout; “and you bring me the rule, Tom; and I shall want the step-ladder, and I had better have a kitchen-chair, too; and, Jim!”"},{"id":"biggs","name":"Biggs","role":"minor","firstAppearance":"s5","summary":"First mention: “Biggs’s boy was the first to come round.”"},{"id":"uncle-podger","name":"Uncle Podger","role":"minor","firstAppearance":"s3","summary":"First mention: “He always reminds me of my poor Uncle Podger.”"},{"id":"henley","name":"Henley","role":"minor","firstAppearance":"s13","summary":"First mention: “From Medmenham to sweet Hambledon Lock the river is full of peaceful beauty, but, after it passes Greenlands, the rather uninteresting looking river residence of my newsagent—a quiet unassuming old gentleman, who may…”"},{"id":"henry","name":"Henry","role":"minor","firstAppearance":"s8","summary":"First mention: “Henry VIII.”"},{"id":"mrs-thomas","name":"Mrs. Thomas","role":"minor","firstAppearance":"s7","summary":"First mention: “The river in its Sunday garb.—Dress on the river.—A chance for the men.—Absence of taste in Harris.—George’s blazer.—A day with the fashion-plate young lady.—Mrs.”"},{"id":"herr-slossenn-boschen","name":"Herr Slossenn Boschen","role":"minor","firstAppearance":"s8","summary":"First mention: “And then those two young men got up, and asked us if we had ever heard Herr Slossenn Boschen (who had just arrived, and was then down in the supper-room) sing his great German comic song.”"},{"id":"emily","name":"Emily","role":"minor","firstAppearance":"s9","summary":"First mention: ““Go back, Emily, and see what it is they want,” says one; and Emily comes back, and asks what it is.”"},{"id":"king-john","name":"King John","role":"minor","firstAppearance":"s11","summary":"First mention: “King John has slept at Duncroft Hall, and all the day before the little town of Staines has echoed to the clang of armed men, and the clatter of great horses over its rough stones, and the shouts of captains, and the…”"}],"relationships":[{"id":"r1","source":"george","target":"harris","weight":170,"phases":[{"at":"s1","type":"together","label":"Appear together","weight":11,"note":"First named together in Ch. 1."},{"at":"s2","type":"together","label":"Often together","weight":14},{"at":"s4","type":"together","label":"Constantly together","weight":43}]},{"id":"r2","source":"george","target":"montmorency","weight":30,"phases":[{"at":"s1","type":"together","label":"Appear together","weight":3,"note":"First named together in Ch. 1."},{"at":"s11","type":"together","label":"Often together","weight":16}]},{"id":"r3","source":"harris","target":"montmorency","weight":37,"phases":[{"at":"s1","type":"together","label":"Appear together","weight":3,"note":"First named together in Ch. 1."},{"at":"s6","type":"together","label":"Often together","weight":12}]},{"id":"r4","source":"biggs","target":"harris","weight":5,"phases":[{"at":"s5","type":"together","label":"Appear together","weight":5,"note":"First named together in Ch. 5."}]},{"id":"r5","source":"biggs","target":"montmorency","weight":4,"phases":[{"at":"s5","type":"together","label":"Appear together","weight":4,"note":"First named together in Ch. 5."}]},{"id":"r6","source":"harris","target":"mrs-thomas","weight":5,"phases":[{"at":"s6","type":"together","label":"Appear together","weight":1,"note":"First named together in Ch. 6."}]},{"id":"r7","source":"george","target":"mrs-thomas","weight":3,"phases":[{"at":"s6","type":"together","label":"Appear together","weight":1,"note":"First named together in Ch. 6."}]},{"id":"r8","source":"harris","target":"henry","weight":3,"phases":[{"at":"s8","type":"together","label":"Appear together","weight":1,"note":"First named together in Ch. 8."}]},{"id":"r9","source":"george","target":"tom","weight":4,"phases":[{"at":"s10","type":"together","label":"Appear together","weight":3,"note":"First named together in Ch. 10."}]},{"id":"r10","source":"montmorency","target":"tom","weight":4,"phases":[{"at":"s13","type":"together","label":"Appear together","weight":4,"note":"First named together in Ch. 13."}]},{"id":"r11","source":"george","target":"henley","weight":3,"phases":[{"at":"s14","type":"together","label":"Appear together","weight":2,"note":"First named together in Ch. 14."}]}],"provenance":{"kind":"auto-text","method":"Extracted automatically from the full public-domain text. Characters are recurring names with evidence of being people; a link means two names appear in the same or adjacent paragraphs, growing stronger as they share more passages. The kind of relationship is not inferred. Expect missed nicknames, occasional duplicates (a title and a first name for one person) and the odd non-character.","contributors":["Character Chart auto-extractor v1"],"createdAt":"2026-10-20","updatedAt":"2026-10-20","review":{"status":"unreviewed","notes":"Generated automatically; not checked by a person."}},"license":"CC BY 4.0 (map data). Source text: public domain."}