{"schemaVersion":1,"workId":"OL63985W","title":"The Legend of Sleepy Hollow","authors":["Washington Irving"],"firstPublished":1820,"edition":{"description":"Sections as detected in Project Gutenberg eBook #41 (no chapter headings found, so the text is split into equal parts).","source":"Project Gutenberg eBook #41","url":"https://www.gutenberg.org/ebooks/41"},"sectionLabel":{"singular":"Part","plural":"Parts"},"sections":[{"id":"s1","label":"Part 1","title":"about 33% through"},{"id":"s2","label":"Part 2","title":"about 67% through"},{"id":"s3","label":"Part 3","title":"about 100% through"}],"characters":[{"id":"ichabod-crane","name":"Ichabod Crane","aliases":["Ichabod"],"role":"protagonist","firstAppearance":"s1","summary":"First mention: “In this by-place of nature there abode, in a remote period of American history, that is to say, some thirty years since, a worthy wight of the name of Ichabod Crane, who sojourned, or, as he expressed it, “tarried,” i…”"},{"id":"van-tassel","name":"Van Tassel","aliases":["Tassel"],"role":"major","firstAppearance":"s1","summary":"First mention: “Among the musical disciples who assembled, one evening in each week, to receive his instructions in psalmody, was Katrina Van Tassel, the daughter and only child of a substantial Dutch farmer.”"},{"id":"brom-bones","name":"Brom Bones","role":"supporting","firstAppearance":"s2","summary":"First mention: “Sometimes his crew would be heard dashing along past the farmhouses at midnight, with whoop and halloo, like a troop of Don Cossacks; and the old dames, startled out of their sleep, would listen for a moment till the…”"},{"id":"gunpowder","name":"Gunpowder","role":"supporting","firstAppearance":"s2","summary":"First mention: “Still he must have had fire and mettle in his day, if we may judge from the name he bore of Gunpowder.”"},{"id":"hans-van","name":"Hans Van","role":"supporting","firstAppearance":"s2","summary":"First mention: “That he might make his appearance before his mistress in the true style of a cavalier, he borrowed a horse from the farmer with whom he was domiciliated, a choleric old Dutchman of the name of Hans Van Ripper, and, th…”"},{"id":"ripper","name":"Ripper","role":"supporting","firstAppearance":"s2","summary":"First mention: “That he might make his appearance before his mistress in the true style of a cavalier, he borrowed a horse from the farmer with whom he was domiciliated, a choleric old Dutchman of the name of Hans Van Ripper, and, th…”"}],"relationships":[{"id":"r1","source":"ichabod-crane","target":"van-tassel","weight":17,"phases":[{"at":"s1","type":"together","label":"Appear together","weight":4,"note":"First named together in Part 1."},{"at":"s2","type":"together","label":"Often together","weight":15}]},{"id":"r2","source":"brom-bones","target":"ichabod-crane","weight":13,"phases":[{"at":"s2","type":"together","label":"Appear together","weight":6,"note":"First named together in Part 2."},{"at":"s3","type":"together","label":"Often together","weight":13}]},{"id":"r3","source":"brom-bones","target":"van-tassel","weight":6,"phases":[{"at":"s2","type":"together","label":"Appear together","weight":6,"note":"First named together in Part 2."}]},{"id":"r4","source":"hans-van","target":"ichabod-crane","weight":9,"phases":[{"at":"s2","type":"together","label":"Appear together","weight":3,"note":"First named together in Part 2."}]},{"id":"r5","source":"ichabod-crane","target":"ripper","weight":9,"phases":[{"at":"s2","type":"together","label":"Appear together","weight":3,"note":"First named together in Part 2."}]},{"id":"r6","source":"gunpowder","target":"ichabod-crane","weight":6,"phases":[{"at":"s2","type":"together","label":"Appear together","weight":1,"note":"First named together in Part 2."}]},{"id":"r7","source":"hans-van","target":"ripper","weight":11,"phases":[{"at":"s2","type":"together","label":"Appear together","weight":4,"note":"First named together in Part 2."}]},{"id":"r8","source":"gunpowder","target":"hans-van","weight":4,"phases":[{"at":"s2","type":"together","label":"Appear together","weight":1,"note":"First named together in Part 2."}]},{"id":"r9","source":"gunpowder","target":"ripper","weight":4,"phases":[{"at":"s2","type":"together","label":"Appear together","weight":1,"note":"First named together in Part 2."}]},{"id":"r10","source":"hans-van","target":"van-tassel","weight":4,"phases":[{"at":"s2","type":"together","label":"Appear together","weight":2,"note":"First named together in Part 2."}]},{"id":"r11","source":"ripper","target":"van-tassel","weight":4,"phases":[{"at":"s2","type":"together","label":"Appear together","weight":2,"note":"First named together in Part 2."}]},{"id":"r12","source":"brom-bones","target":"gunpowder","weight":4,"phases":[{"at":"s3","type":"together","label":"Appear together","weight":4,"note":"First named together in Part 3."}]},{"id":"r13","source":"brom-bones","target":"hans-van","weight":4,"phases":[{"at":"s3","type":"together","label":"Appear together","weight":4,"note":"First named together in Part 3."}]},{"id":"r14","source":"brom-bones","target":"ripper","weight":4,"phases":[{"at":"s3","type":"together","label":"Appear together","weight":4,"note":"First named together in Part 3."}]}],"provenance":{"kind":"auto-text","method":"Extracted automatically from the full public-domain text. Characters are recurring names with evidence of being people; a link means two names appear in the same or adjacent paragraphs, growing stronger as they share more passages. The kind of relationship is not inferred. Expect missed nicknames, occasional duplicates (a title and a first name for one person) and the odd non-character.","contributors":["Character Chart auto-extractor v1"],"createdAt":"2026-10-20","updatedAt":"2026-10-20","review":{"status":"unreviewed","notes":"Generated automatically; not checked by a person."}},"license":"CC BY 4.0 (map data). Source text: public domain."}