{"schemaVersion":1,"workId":"OL28570037W","title":"The Wind in the Willows","authors":["Kenneth Grahame"],"firstPublished":1908,"edition":{"description":"Sections as detected in Project Gutenberg eBook #289.","source":"Project Gutenberg eBook #289","url":"https://www.gutenberg.org/ebooks/289"},"sectionLabel":{"singular":"Chapter","plural":"Chapters"},"sections":[{"id":"s1","label":"Ch. 1","title":"THE RIVER BANK"},{"id":"s2","label":"Ch. 2","title":"THE OPEN ROAD"},{"id":"s3","label":"Ch. 3","title":"THE WILD WOOD"},{"id":"s4","label":"Ch. 4","title":"MR. BADGER"},{"id":"s5","label":"Ch. 5","title":"DULCE DOMUM"},{"id":"s6","label":"Ch. 6","title":"MR. TOAD"},{"id":"s7","label":"Ch. 7","title":"THE PIPER AT THE GATES OF DAWN"},{"id":"s8","label":"Ch. 8","title":"TOAD’S ADVENTURES"},{"id":"s9","label":"Ch. 9","title":"WAYFARERS ALL"},{"id":"s10","label":"Ch. 10","title":"THE FURTHER ADVENTURES OF TOAD"},{"id":"s11","label":"Ch. 11","title":"“LIKE SUMMER TEMPESTS CAME HIS TEARS”"},{"id":"s12","label":"Ch. 12","title":"THE RETURN OF ULYSSES"}],"characters":[{"id":"toad","name":"Toad","aliases":["Mr. Toad"],"role":"protagonist","firstAppearance":"s1","summary":"First mention: ““Toad’s out, for one,” replied the Otter.”"},{"id":"rat","name":"Rat","role":"protagonist","firstAppearance":"s1","summary":"First mention: ““Hullo, Rat!”"},{"id":"mole","name":"Mole","role":"protagonist","firstAppearance":"s1","summary":"First mention: ““Sixpence for the privilege of passing by the private road!” He was bowled over in an instant by the impatient and contemptuous Mole, who trotted along the side of the hedge chaffing the other rabbits as they peeped h…”"},{"id":"badger","name":"Badger","aliases":["Mr. Badger"],"role":"major","firstAppearance":"s1","summary":"First mention: “And then there’s Badger, of course.”"},{"id":"ratty","name":"Ratty","role":"supporting","firstAppearance":"s1","summary":"First mention: ““Why didn’t you invite me, Ratty?””"},{"id":"otter","name":"Otter","role":"minor","firstAppearance":"s1","summary":"First mention: “A broad glistening muzzle showed itself above the edge of the bank, and the Otter hauled himself out and shook the water from his coat.”"},{"id":"portly","name":"Portly","role":"minor","firstAppearance":"s7","summary":"First mention: “I got out of him that young Portly hasn’t learnt to swim very well yet, and I can see he’s thinking of the weir.”"}],"relationships":[{"id":"r1","source":"mole","target":"rat","weight":244,"phases":[{"at":"s1","type":"together","label":"Often together","weight":38},{"at":"s2","type":"together","label":"Constantly together","weight":67}]},{"id":"r2","source":"badger","target":"mole","weight":78,"phases":[{"at":"s1","type":"together","label":"Appear together","weight":4,"note":"First named together in Ch. 1."},{"at":"s4","type":"together","label":"Often together","weight":37},{"at":"s6","type":"together","label":"Constantly together","weight":49}]},{"id":"r3","source":"badger","target":"rat","weight":94,"phases":[{"at":"s1","type":"together","label":"Appear together","weight":5,"note":"First named together in Ch. 1."},{"at":"s3","type":"together","label":"Often together","weight":13},{"at":"s6","type":"together","label":"Constantly together","weight":52}]},{"id":"r4","source":"otter","target":"rat","weight":26,"phases":[{"at":"s1","type":"together","label":"Appear together","weight":7,"note":"First named together in Ch. 1."},{"at":"s4","type":"together","label":"Often together","weight":16}]},{"id":"r5","source":"otter","target":"ratty","weight":3,"phases":[{"at":"s1","type":"together","label":"Appear together","weight":1,"note":"First named together in Ch. 1."}]},{"id":"r6","source":"rat","target":"ratty","weight":52,"phases":[{"at":"s1","type":"together","label":"Appear together","weight":5,"note":"First named together in Ch. 1."},{"at":"s2","type":"together","label":"Often together","weight":16},{"at":"s6","type":"together","label":"Constantly together","weight":41}]},{"id":"r7","source":"rat","target":"toad","weight":141,"phases":[{"at":"s1","type":"together","label":"Appear together","weight":5,"note":"First named together in Ch. 1."},{"at":"s2","type":"together","label":"Often together","weight":36},{"at":"s4","type":"together","label":"Constantly together","weight":47}]},{"id":"r8","source":"otter","target":"toad","weight":7,"phases":[{"at":"s1","type":"together","label":"Appear together","weight":5,"note":"First named together in Ch. 1."}]},{"id":"r9","source":"mole","target":"ratty","weight":40,"phases":[{"at":"s1","type":"together","label":"Appear together","weight":4,"note":"First named together in Ch. 1."},{"at":"s2","type":"together","label":"Often together","weight":12},{"at":"s12","type":"together","label":"Constantly together","weight":40}]},{"id":"r10","source":"mole","target":"toad","weight":97,"phases":[{"at":"s1","type":"together","label":"Appear together","weight":2,"note":"First named together in Ch. 1."},{"at":"s2","type":"together","label":"Often together","weight":30},{"at":"s6","type":"together","label":"Constantly together","weight":54}]},{"id":"r11","source":"ratty","target":"toad","weight":33,"phases":[{"at":"s1","type":"together","label":"Appear together","weight":1,"note":"First named together in Ch. 1."},{"at":"s2","type":"together","label":"Often together","weight":13}]},{"id":"r12","source":"mole","target":"otter","weight":21,"phases":[{"at":"s1","type":"together","label":"Appear together","weight":2,"note":"First named together in Ch. 1."},{"at":"s5","type":"together","label":"Often together","weight":12}]},{"id":"r13","source":"badger","target":"otter","weight":14,"phases":[{"at":"s1","type":"together","label":"Appear together","weight":2,"note":"First named together in Ch. 1."},{"at":"s11","type":"together","label":"Often together","weight":13}]},{"id":"r14","source":"badger","target":"toad","weight":106,"phases":[{"at":"s3","type":"together","label":"Appear together","weight":1,"note":"First named together in Ch. 3."},{"at":"s5","type":"together","label":"Often together","weight":13},{"at":"s6","type":"together","label":"Constantly together","weight":46}]},{"id":"r15","source":"badger","target":"ratty","weight":14,"phases":[{"at":"s4","type":"together","label":"Appear together","weight":5,"note":"First named together in Ch. 4."},{"at":"s6","type":"together","label":"Often together","weight":12}]},{"id":"r16","source":"mole","target":"portly","weight":9,"phases":[{"at":"s7","type":"together","label":"Appear together","weight":9,"note":"First named together in Ch. 7."}]},{"id":"r17","source":"otter","target":"portly","weight":7,"phases":[{"at":"s7","type":"together","label":"Appear together","weight":7,"note":"First named together in Ch. 7."}]},{"id":"r18","source":"portly","target":"rat","weight":10,"phases":[{"at":"s7","type":"together","label":"Appear together","weight":10,"note":"First named together in Ch. 7."}]}],"provenance":{"kind":"auto-text","method":"Extracted automatically from the full public-domain text. Characters are recurring names with evidence of being people; a link means two names appear in the same or adjacent paragraphs, growing stronger as they share more passages. The kind of relationship is not inferred. Expect missed nicknames, occasional duplicates (a title and a first name for one person) and the odd non-character.","contributors":["Character Chart auto-extractor v1"],"createdAt":"2026-10-20","updatedAt":"2026-10-20","review":{"status":"unreviewed","notes":"Generated automatically; not checked by a person."}},"license":"CC BY 4.0 (map data). Source text: public domain."}