{
 "schemaVersion": 1,
 "workId": "OL52267W",
 "title": "The Time Machine",
 "authors": [
  "H. G. Wells"
 ],
 "firstPublished": 1895,
 "edition": {
  "description": "Sections as detected in Project Gutenberg eBook #35.",
  "source": "Project Gutenberg eBook #35",
  "url": "https://www.gutenberg.org/ebooks/35"
 },
 "sectionLabel": {
  "singular": "Chapter",
  "plural": "Chapters"
 },
 "sections": [
  {
   "id": "s1",
   "label": "Ch. 1",
   "title": "Introduction"
  },
  {
   "id": "s2",
   "label": "Ch. 2",
   "title": "The Machine"
  },
  {
   "id": "s3",
   "label": "Ch. 3",
   "title": "The Time Traveller Returns"
  },
  {
   "id": "s4",
   "label": "Ch. 4",
   "title": "Time Travelling"
  },
  {
   "id": "s5",
   "label": "Ch. 5",
   "title": "In the Golden Age"
  },
  {
   "id": "s6",
   "label": "Ch. 6",
   "title": "The Sunset of Mankind"
  },
  {
   "id": "s7",
   "label": "Ch. 7",
   "title": "A Sudden Shock"
  },
  {
   "id": "s8",
   "label": "Ch. 8",
   "title": "Explanation"
  },
  {
   "id": "s9",
   "label": "Ch. 9",
   "title": "The Morlocks"
  },
  {
   "id": "s10",
   "label": "Ch. 10",
   "title": "When Night Came"
  },
  {
   "id": "s11",
   "label": "Ch. 11",
   "title": "The Palace of Green Porcelain"
  },
  {
   "id": "s12",
   "label": "Ch. 12",
   "title": "In the Darkness"
  },
  {
   "id": "s13",
   "label": "Ch. 13",
   "title": "The Trap of the White Sphinx"
  },
  {
   "id": "s14",
   "label": "Ch. 14",
   "title": "The Further Vision"
  },
  {
   "id": "s15",
   "label": "Ch. 15",
   "title": "The Time Traveller’s Return"
  },
  {
   "id": "s16",
   "label": "Ch. 16",
   "title": "After the Story"
  }
 ],
 "characters": [
  {
   "id": "weena",
   "name": "Weena",
   "role": "protagonist",
   "firstAppearance": "s8",
   "summary": "First mention: “Then I tried talk, and found that her name was Weena, which, though I don’t know what it meant, somehow seemed appropriate enough.”"
  },
  {
   "id": "morlocks",
   "name": "Morlocks",
   "role": "protagonist",
   "firstAppearance": "s8",
   "summary": "First mention: “What had happened to the Undergrounders I did not yet suspect; but, from what I had seen of the Morlocks—that, by the bye, was the name by which these creatures were called—I could imagine that the modification of the…”"
  },
  {
   "id": "psychologist",
   "name": "Psychologist",
   "role": "major",
   "firstAppearance": "s1",
   "summary": "First mention: ““That is all right,” said the Psychologist.”"
  },
  {
   "id": "medical-man",
   "name": "Medical Man",
   "role": "major",
   "firstAppearance": "s1",
   "summary": "First mention: ““But,” said the Medical Man, staring hard at a coal in the fire, “if Time is really only a fourth dimension of Space, why is it, and why has it always been, regarded as something different?”"
  },
  {
   "id": "traveller",
   "name": "Traveller",
   "role": "major",
   "firstAppearance": "s1",
   "summary": "First mention: “The Time Traveller (for so it will be convenient to speak of him) was expounding a recondite matter to us.”"
  },
  {
   "id": "filby",
   "name": "Filby",
   "role": "major",
   "firstAppearance": "s1",
   "summary": "First mention: ““Is not that rather a large thing to expect us to begin upon?” said Filby, an argumentative person with red hair.”"
  },
  {
   "id": "editor",
   "name": "Editor",
   "role": "major",
   "firstAppearance": "s3",
   "summary": "First mention: ““It seems a pity to let the dinner spoil,” said the Editor of a well-known daily paper; and thereupon the Doctor rang the bell.”"
  },
  {
   "id": "eloi",
   "name": "Eloi",
   "role": "supporting",
   "firstAppearance": "s8",
   "summary": "First mention: “What had happened to the Undergrounders I did not yet suspect; but, from what I had seen of the Morlocks—that, by the bye, was the name by which these creatures were called—I could imagine that the modification of the…”"
  }
 ],
 "relationships": [
  {
   "id": "r1",
   "source": "medical-man",
   "target": "traveller",
   "weight": 5,
   "phases": [
    {
     "at": "s1",
     "type": "together",
     "label": "Appear together",
     "weight": 2,
     "note": "First named together in Ch. 1."
    }
   ]
  },
  {
   "id": "r2",
   "source": "medical-man",
   "target": "psychologist",
   "weight": 9,
   "phases": [
    {
     "at": "s1",
     "type": "together",
     "label": "Appear together",
     "weight": 1,
     "note": "First named together in Ch. 1."
    }
   ]
  },
  {
   "id": "r3",
   "source": "filby",
   "target": "psychologist",
   "weight": 3,
   "phases": [
    {
     "at": "s1",
     "type": "together",
     "label": "Appear together",
     "weight": 1,
     "note": "First named together in Ch. 1."
    }
   ]
  },
  {
   "id": "r4",
   "source": "psychologist",
   "target": "traveller",
   "weight": 3,
   "phases": [
    {
     "at": "s1",
     "type": "together",
     "label": "Appear together",
     "weight": 1,
     "note": "First named together in Ch. 1."
    }
   ]
  },
  {
   "id": "r5",
   "source": "filby",
   "target": "medical-man",
   "weight": 3,
   "phases": [
    {
     "at": "s1",
     "type": "together",
     "label": "Appear together",
     "weight": 1,
     "note": "First named together in Ch. 1."
    }
   ]
  },
  {
   "id": "r6",
   "source": "editor",
   "target": "psychologist",
   "weight": 5,
   "phases": [
    {
     "at": "s3",
     "type": "together",
     "label": "Appear together",
     "weight": 5,
     "note": "First named together in Ch. 3."
    }
   ]
  },
  {
   "id": "r7",
   "source": "editor",
   "target": "medical-man",
   "weight": 4,
   "phases": [
    {
     "at": "s3",
     "type": "together",
     "label": "Appear together",
     "weight": 4,
     "note": "First named together in Ch. 3."
    }
   ]
  },
  {
   "id": "r8",
   "source": "editor",
   "target": "traveller",
   "weight": 7,
   "phases": [
    {
     "at": "s3",
     "type": "together",
     "label": "Appear together",
     "weight": 4,
     "note": "First named together in Ch. 3."
    }
   ]
  },
  {
   "id": "r9",
   "source": "eloi",
   "target": "morlocks",
   "weight": 8,
   "phases": [
    {
     "at": "s8",
     "type": "together",
     "label": "Appear together",
     "weight": 2,
     "note": "First named together in Ch. 8."
    }
   ]
  },
  {
   "id": "r10",
   "source": "morlocks",
   "target": "weena",
   "weight": 29,
   "phases": [
    {
     "at": "s8",
     "type": "together",
     "label": "Appear together",
     "weight": 2,
     "note": "First named together in Ch. 8."
    },
    {
     "at": "s10",
     "type": "together",
     "label": "Often together",
     "weight": 14
    }
   ]
  },
  {
   "id": "r11",
   "source": "eloi",
   "target": "weena",
   "weight": 9,
   "phases": [
    {
     "at": "s8",
     "type": "together",
     "label": "Appear together",
     "weight": 2,
     "note": "First named together in Ch. 8."
    }
   ]
  }
 ],
 "provenance": {
  "kind": "auto-text",
  "method": "Extracted automatically from the full public-domain text. Characters are recurring names with evidence of being people; a link means two names appear in the same or adjacent paragraphs, growing stronger as they share more passages. The kind of relationship is not inferred. Expect missed nicknames, occasional duplicates (a title and a first name for one person) and the odd non-character.",
  "contributors": [
   "Character Chart auto-extractor v1"
  ],
  "createdAt": "2026-10-20",
  "updatedAt": "2026-10-20",
  "review": {
   "status": "unreviewed",
   "notes": "Generated automatically; not checked by a person."
  }
 },
 "license": "CC BY 4.0 (map data). Source text: public domain."
}
