{"schemaVersion":1,"workId":"OL15449W","title":"The Princess and the Goblin","authors":["George MacDonald"],"firstPublished":1872,"edition":{"description":"Sections as detected in Project Gutenberg eBook #708.","source":"Project Gutenberg eBook #708","url":"https://www.gutenberg.org/ebooks/708"},"sectionLabel":{"singular":"Chapter","plural":"Chapters"},"sections":[{"id":"s1","label":"Ch. 1","title":"Why the Princess Has a Story About Her"},{"id":"s2","label":"Ch. 2","title":"The Princess Loses Herself"},{"id":"s3","label":"Ch. 3","title":"The Princess and--We Shall See Who"},{"id":"s4","label":"Ch. 4","title":"What the Nurse Thought of It"},{"id":"s5","label":"Ch. 5","title":"The Princess Lets Well Alone"},{"id":"s6","label":"Ch. 6","title":"The Little Miner"},{"id":"s7","label":"Ch. 7","title":"The Mines"},{"id":"s8","label":"Ch. 8","title":"The Goblins"},{"id":"s9","label":"Ch. 9","title":"The Hall of the Goblin Palace"},{"id":"s10","label":"Ch. 10","title":"The Princess's King-Papa"},{"id":"s11","label":"Ch. 11","title":"The Old Lady's Bedroom"},{"id":"s12","label":"Ch. 12","title":"A Short Chapter About Curdie"},{"id":"s13","label":"Ch. 13","title":"The Cobs' Creatures"},{"id":"s14","label":"Ch. 14","title":"That Night Week"},{"id":"s15","label":"Ch. 15","title":"Woven and Then Spun"},{"id":"s16","label":"Ch. 16","title":"The Ring"},{"id":"s17","label":"Ch. 17","title":"Springtime"},{"id":"s18","label":"Ch. 18","title":"Curdie's Clue"},{"id":"s19","label":"Ch. 19","title":"Goblin Counsels"},{"id":"s20","label":"Ch. 20","title":"Irene's Clue"},{"id":"s21","label":"Ch. 21","title":"The Escape"},{"id":"s22","label":"Ch. 22","title":"The Old Lady and Curdie"},{"id":"s23","label":"Ch. 23","title":"Curdie and His Mother"},{"id":"s24","label":"Ch. 24","title":"Irene Behaves Like a Princess"},{"id":"s25","label":"Ch. 25","title":"Curdie Comes to Grief"},{"id":"s26","label":"Ch. 26","title":"The Goblin-Miners"},{"id":"s27","label":"Ch. 27","title":"The Goblins in the King's House"},{"id":"s28","label":"Ch. 28","title":"Curdie's Guide"},{"id":"s29","label":"Ch. 29","title":"Masonwork"},{"id":"s30","label":"Ch. 30","title":"The King and the Kiss"},{"id":"s31","label":"Ch. 31","title":"The Subterranean Waters"},{"id":"s32","label":"Ch. 32","title":"The Last Chapter"}],"characters":[{"id":"curdie","name":"Curdie","role":"protagonist","firstAppearance":"s6","summary":"First mention: “'My name's Curdie, little princess.'”"},{"id":"irene","name":"Irene","role":"major","firstAppearance":"s1","summary":"First mention: “The princess, whose name was Irene, was born there, but she was sent soon after her birth, because her mother was not very strong, to be brought up by country people in a large house, half castle, half farmhouse, on t…”"},{"id":"lootie","name":"Lootie","role":"major","firstAppearance":"s5","summary":"First mention: “'I wonder, Lootie'--that was her pet name for her nurse--'what pigeons' eggs taste like?”"},{"id":"harelip","name":"Harelip","role":"minor","firstAppearance":"s18","summary":"First mention: “'You must acknowledge, however,' the king said, with a little groan, 'that this at least is no whim of Harelip's, but a matter of State policy.”"},{"id":"peter","name":"Peter","role":"minor","firstAppearance":"s6","summary":"First mention: “'I'm Peter's son.'”"},{"id":"glump","name":"Glump","role":"minor","firstAppearance":"s9","summary":"First mention: “'Glump,' answered several voices.”"},{"id":"sir-walter","name":"Sir Walter","role":"minor","firstAppearance":"s24","summary":"First mention: “Sir Walter, will you take charge of me?'”"}],"relationships":[{"id":"r1","source":"irene","target":"lootie","weight":38,"phases":[{"at":"s5","type":"together","label":"Appear together","weight":1,"note":"First named together in Ch. 5."},{"at":"s6","type":"together","label":"Often together","weight":13}]},{"id":"r2","source":"curdie","target":"irene","weight":79,"phases":[{"at":"s6","type":"together","label":"Often together","weight":13},{"at":"s21","type":"together","label":"Constantly together","weight":49}]},{"id":"r3","source":"curdie","target":"lootie","weight":26,"phases":[{"at":"s6","type":"together","label":"Appear together","weight":6,"note":"First named together in Ch. 6."},{"at":"s21","type":"together","label":"Often together","weight":13}]},{"id":"r4","source":"curdie","target":"peter","weight":7,"phases":[{"at":"s7","type":"together","label":"Appear together","weight":1,"note":"First named together in Ch. 7."}]},{"id":"r5","source":"curdie","target":"glump","weight":4,"phases":[{"at":"s9","type":"together","label":"Appear together","weight":2,"note":"First named together in Ch. 9."}]},{"id":"r6","source":"curdie","target":"harelip","weight":6,"phases":[{"at":"s18","type":"together","label":"Appear together","weight":1,"note":"First named together in Ch. 18."}]},{"id":"r7","source":"lootie","target":"peter","weight":3,"phases":[{"at":"s23","type":"together","label":"Appear together","weight":1,"note":"First named together in Ch. 23."}]},{"id":"r8","source":"lootie","target":"sir-walter","weight":5,"phases":[{"at":"s24","type":"together","label":"Appear together","weight":4,"note":"First named together in Ch. 24."}]},{"id":"r9","source":"curdie","target":"sir-walter","weight":4,"phases":[{"at":"s26","type":"together","label":"Appear together","weight":1,"note":"First named together in Ch. 26."}]},{"id":"r10","source":"harelip","target":"lootie","weight":3,"phases":[{"at":"s27","type":"together","label":"Appear together","weight":3,"note":"First named together in Ch. 27."}]},{"id":"r11","source":"irene","target":"peter","weight":4,"phases":[{"at":"s29","type":"together","label":"Appear together","weight":1,"note":"First named together in Ch. 29."}]}],"provenance":{"kind":"auto-text","method":"Extracted automatically from the full public-domain text. Characters are recurring names with evidence of being people; a link means two names appear in the same or adjacent paragraphs, growing stronger as they share more passages. The kind of relationship is not inferred. Expect missed nicknames, occasional duplicates (a title and a first name for one person) and the odd non-character.","contributors":["Character Chart auto-extractor v1"],"createdAt":"2026-10-20","updatedAt":"2026-10-20","review":{"status":"unreviewed","notes":"Generated automatically; not checked by a person."}},"license":"CC BY 4.0 (map data). Source text: public domain."}