{"schemaVersion":1,"workId":"OL2771987W","title":"Herland","authors":["Charlotte Perkins Gilman","Alex Goody","Eva Kumar"],"firstPublished":1915,"edition":{"description":"Sections as detected in Project Gutenberg eBook #32.","source":"Project Gutenberg eBook #32","url":"https://www.gutenberg.org/ebooks/32"},"sectionLabel":{"singular":"Chapter","plural":"Chapters"},"sections":[{"id":"s1","label":"Ch. 1","title":"A Not Unnatural Enterprise"},{"id":"s2","label":"Ch. 2","title":"Rash Advances"},{"id":"s3","label":"Ch. 3","title":"A Peculiar Imprisonment"},{"id":"s4","label":"Ch. 4","title":"Our Venture"},{"id":"s5","label":"Ch. 5","title":"A Unique History"},{"id":"s6","label":"Ch. 6","title":"Comparisons Are Odious"},{"id":"s7","label":"Ch. 7","title":"Our Growing Modesty"},{"id":"s8","label":"Ch. 8","title":"The Girls of Herland"},{"id":"s9","label":"Ch. 9","title":"Our Relations and Theirs"},{"id":"s10","label":"Ch. 10","title":"Their Religions and Our Marriages"},{"id":"s11","label":"Ch. 11","title":"Our Difficulties"},{"id":"s12","label":"Ch. 12","title":"Expelled"}],"characters":[{"id":"terry","name":"Terry","role":"protagonist","firstAppearance":"s1","summary":"First mention: “There were three of us, classmates and friends--Terry O.”"},{"id":"jeff","name":"Jeff","role":"major","firstAppearance":"s1","summary":"First mention: “Terry was strong on facts--geography and meteorology and those; Jeff could beat him any time on biology, and I didn’t care what it was they talked about, so long as it connected with human life, somehow.”"},{"id":"ellador","name":"Ellador","role":"major","firstAppearance":"s2","summary":"First mention: ““Celis,” she said distinctly, pointing to the one in blue; “Alima”--the one in rose; then, with a vivid imitation of Terry’s impressive manner, she laid a firm delicate hand on her gold-green jerkin--“Ellador.”"},{"id":"alima","name":"Alima","role":"supporting","firstAppearance":"s2","summary":"First mention: ““Celis,” she said distinctly, pointing to the one in blue; “Alima”--the one in rose; then, with a vivid imitation of Terry’s impressive manner, she laid a firm delicate hand on her gold-green jerkin--“Ellador.”"},{"id":"somel","name":"Somel","role":"supporting","firstAppearance":"s3","summary":"First mention: “Mine was named Somel, Jeff’s Zava, and Terry’s Moadine.”"},{"id":"celis","name":"Celis","role":"supporting","firstAppearance":"s2","summary":"First mention: ““Celis,” she said distinctly, pointing to the one in blue; “Alima”--the one in rose; then, with a vivid imitation of Terry’s impressive manner, she laid a firm delicate hand on her gold-green jerkin--“Ellador.”"},{"id":"moadine","name":"Moadine","role":"supporting","firstAppearance":"s5","summary":"First mention: “But they made notes; Moadine read them to us.”"},{"id":"zava","name":"Zava","role":"minor","firstAppearance":"s4","summary":"First mention: ““Have you no kind of life where it is possible?” asked Zava.”"},{"id":"van","name":"Van","role":"minor","firstAppearance":"s1","summary":"First mention: ““What does he say, Van?””"}],"relationships":[{"id":"r1","source":"jeff","target":"terry","weight":102,"phases":[{"at":"s1","type":"together","label":"Often together","weight":13},{"at":"s3","type":"together","label":"Constantly together","weight":51}]},{"id":"r2","source":"terry","target":"van","weight":5,"phases":[{"at":"s1","type":"together","label":"Appear together","weight":2,"note":"First named together in Ch. 1."}]},{"id":"r3","source":"alima","target":"celis","weight":15,"phases":[{"at":"s2","type":"together","label":"Appear together","weight":1,"note":"First named together in Ch. 2."},{"at":"s9","type":"together","label":"Often together","weight":12}]},{"id":"r4","source":"celis","target":"terry","weight":18,"phases":[{"at":"s2","type":"together","label":"Appear together","weight":1,"note":"First named together in Ch. 2."},{"at":"s10","type":"together","label":"Often together","weight":12}]},{"id":"r5","source":"celis","target":"ellador","weight":18,"phases":[{"at":"s2","type":"together","label":"Appear together","weight":1,"note":"First named together in Ch. 2."},{"at":"s9","type":"together","label":"Often together","weight":13}]},{"id":"r6","source":"alima","target":"terry","weight":39,"phases":[{"at":"s2","type":"together","label":"Appear together","weight":3,"note":"First named together in Ch. 2."},{"at":"s8","type":"together","label":"Often together","weight":16}]},{"id":"r7","source":"alima","target":"ellador","weight":14,"phases":[{"at":"s2","type":"together","label":"Appear together","weight":1,"note":"First named together in Ch. 2."},{"at":"s11","type":"together","label":"Often together","weight":14}]},{"id":"r8","source":"ellador","target":"terry","weight":24,"phases":[{"at":"s2","type":"together","label":"Appear together","weight":1,"note":"First named together in Ch. 2."},{"at":"s11","type":"together","label":"Often together","weight":17}]},{"id":"r9","source":"alima","target":"jeff","weight":13,"phases":[{"at":"s3","type":"together","label":"Appear together","weight":2,"note":"First named together in Ch. 3."},{"at":"s11","type":"together","label":"Often together","weight":13}]},{"id":"r10","source":"somel","target":"terry","weight":11,"phases":[{"at":"s3","type":"together","label":"Appear together","weight":2,"note":"First named together in Ch. 3."}]},{"id":"r11","source":"jeff","target":"somel","weight":6,"phases":[{"at":"s3","type":"together","label":"Appear together","weight":1,"note":"First named together in Ch. 3."}]},{"id":"r12","source":"ellador","target":"jeff","weight":16,"phases":[{"at":"s4","type":"together","label":"Appear together","weight":1,"note":"First named together in Ch. 4."},{"at":"s12","type":"together","label":"Often together","weight":16}]},{"id":"r13","source":"celis","target":"jeff","weight":14,"phases":[{"at":"s4","type":"together","label":"Appear together","weight":1,"note":"First named together in Ch. 4."},{"at":"s12","type":"together","label":"Often together","weight":14}]},{"id":"r14","source":"jeff","target":"zava","weight":7,"phases":[{"at":"s4","type":"together","label":"Appear together","weight":1,"note":"First named together in Ch. 4."}]},{"id":"r15","source":"jeff","target":"moadine","weight":6,"phases":[{"at":"s5","type":"together","label":"Appear together","weight":1,"note":"First named together in Ch. 5."}]},{"id":"r16","source":"terry","target":"zava","weight":7,"phases":[{"at":"s5","type":"together","label":"Appear together","weight":1,"note":"First named together in Ch. 5."}]},{"id":"r17","source":"moadine","target":"terry","weight":12,"phases":[{"at":"s6","type":"together","label":"Appear together","weight":2,"note":"First named together in Ch. 6."},{"at":"s12","type":"together","label":"Often together","weight":12}]},{"id":"r18","source":"moadine","target":"somel","weight":5,"phases":[{"at":"s6","type":"together","label":"Appear together","weight":1,"note":"First named together in Ch. 6."}]},{"id":"r19","source":"somel","target":"zava","weight":4,"phases":[{"at":"s7","type":"together","label":"Appear together","weight":1,"note":"First named together in Ch. 7."}]},{"id":"r20","source":"moadine","target":"zava","weight":3,"phases":[{"at":"s7","type":"together","label":"Appear together","weight":1,"note":"First named together in Ch. 7."}]},{"id":"r21","source":"ellador","target":"somel","weight":6,"phases":[{"at":"s8","type":"together","label":"Appear together","weight":1,"note":"First named together in Ch. 8."}]},{"id":"r22","source":"alima","target":"moadine","weight":7,"phases":[{"at":"s11","type":"together","label":"Appear together","weight":3,"note":"First named together in Ch. 11."}]},{"id":"r23","source":"ellador","target":"zava","weight":3,"phases":[{"at":"s12","type":"together","label":"Appear together","weight":3,"note":"First named together in Ch. 12."}]}],"provenance":{"kind":"auto-text","method":"Extracted automatically from the full public-domain text. Characters are recurring names with evidence of being people; a link means two names appear in the same or adjacent paragraphs, growing stronger as they share more passages. The kind of relationship is not inferred. Expect missed nicknames, occasional duplicates (a title and a first name for one person) and the odd non-character.","contributors":["Character Chart auto-extractor v1"],"createdAt":"2026-10-20","updatedAt":"2026-10-20","review":{"status":"unreviewed","notes":"Generated automatically; not checked by a person."}},"license":"CC BY 4.0 (map data). Source text: public domain."}