{
 "schemaVersion": 1,
 "workId": "OL276386W",
 "title": "The Turn of the Screw",
 "authors": [
  "Henry James"
 ],
 "firstPublished": 1898,
 "edition": {
  "description": "Sections as detected in Project Gutenberg eBook #209.",
  "source": "Project Gutenberg eBook #209",
  "url": "https://www.gutenberg.org/ebooks/209"
 },
 "sectionLabel": {
  "singular": "Chapter",
  "plural": "Chapters"
 },
 "sections": [
  {
   "id": "s1",
   "label": "Ch. 1"
  },
  {
   "id": "s2",
   "label": "Ch. 2",
   "title": "This came home to me when, two days later, I drove over with Flora to"
  },
  {
   "id": "s3",
   "label": "Ch. 3",
   "title": "Her thus turning her back on me was fortunately not, for my just"
  },
  {
   "id": "s4",
   "label": "Ch. 4",
   "title": "It was not that I didn’t wait, on this occasion, for more, for I was"
  },
  {
   "id": "s5",
   "label": "Ch. 5",
   "title": "Oh, she let me know as soon as, round the corner of the house, she"
  },
  {
   "id": "s6",
   "label": "Ch. 6",
   "title": "It took of course more than that particular passage to place us"
  },
  {
   "id": "s7",
   "label": "Ch. 7"
  },
  {
   "id": "s8",
   "label": "Ch. 8"
  },
  {
   "id": "s9",
   "label": "Ch. 9"
  },
  {
   "id": "s10",
   "label": "Ch. 10",
   "title": "I remained awhile at the top of the stair, but with the effect"
  },
  {
   "id": "s11",
   "label": "Ch. 11",
   "title": "It was not till late next day that I spoke to Mrs. Grose; the rigor"
  },
  {
   "id": "s12",
   "label": "Ch. 12"
  },
  {
   "id": "s13",
   "label": "Ch. 13"
  },
  {
   "id": "s14",
   "label": "Ch. 14",
   "title": "Walking to church a certain Sunday morning, I had little Miles at my"
  },
  {
   "id": "s15",
   "label": "Ch. 15",
   "title": "The business was practically settled from the moment I never followed"
  },
  {
   "id": "s16",
   "label": "Ch. 16",
   "title": "I had so perfectly expected that the return of my pupils would be"
  },
  {
   "id": "s17",
   "label": "Ch. 17"
  },
  {
   "id": "s18",
   "label": "Ch. 18",
   "title": "The next day, after lessons, Mrs. Grose found a moment to say to me"
  },
  {
   "id": "s19",
   "label": "Ch. 19",
   "title": "We went straight to the lake, as it was called at Bly, and I daresay"
  },
  {
   "id": "s20",
   "label": "Ch. 20"
  },
  {
   "id": "s21",
   "label": "Ch. 21"
  },
  {
   "id": "s22",
   "label": "Ch. 22",
   "title": "Yet it was when she had got off—and I missed her on the spot—that the"
  },
  {
   "id": "s23",
   "label": "Ch. 23",
   "title": "“Oh, more or less.” I fancy my smile was pale. “Not absolutely. We"
  },
  {
   "id": "s24",
   "label": "Ch. 24",
   "title": "My sense of how he received this suffered for a minute from something"
  }
 ],
 "characters": [
  {
   "id": "mrs-grose",
   "name": "Mrs. Grose",
   "role": "protagonist",
   "firstAppearance": "s1",
   "summary": "First mention: “The little girl who accompanied Mrs.”"
  },
  {
   "id": "miles",
   "name": "Miles",
   "role": "major",
   "firstAppearance": "s2",
   "summary": "First mention: “Miles may never go back at all.””"
  },
  {
   "id": "flora",
   "name": "Flora",
   "role": "major",
   "firstAppearance": "s1",
   "summary": "First mention: “To watch, teach, “form” little Flora would too evidently be the making of a happy and useful life.”"
  },
  {
   "id": "quint",
   "name": "Quint",
   "role": "major",
   "firstAppearance": "s5",
   "summary": "First mention: ““Quint!”"
  },
  {
   "id": "miss-jessel",
   "name": "Miss Jessel",
   "role": "supporting",
   "firstAppearance": "s7",
   "summary": "First mention: ““Miss Jessel?””"
  }
 ],
 "relationships": [
  {
   "id": "r1",
   "source": "flora",
   "target": "mrs-grose",
   "weight": 31,
   "phases": [
    {
     "at": "s1",
     "type": "together",
     "label": "Appear together",
     "weight": 2,
     "note": "First named together in Ch. 1."
    },
    {
     "at": "s8",
     "type": "together",
     "label": "Often together",
     "weight": 12
    }
   ]
  },
  {
   "id": "r2",
   "source": "miles",
   "target": "mrs-grose",
   "weight": 21,
   "phases": [
    {
     "at": "s2",
     "type": "together",
     "label": "Appear together",
     "weight": 1,
     "note": "First named together in Ch. 2."
    },
    {
     "at": "s17",
     "type": "together",
     "label": "Often together",
     "weight": 12
    }
   ]
  },
  {
   "id": "r3",
   "source": "flora",
   "target": "miles",
   "weight": 16,
   "phases": [
    {
     "at": "s4",
     "type": "together",
     "label": "Appear together",
     "weight": 1,
     "note": "First named together in Ch. 4."
    },
    {
     "at": "s20",
     "type": "together",
     "label": "Often together",
     "weight": 13
    }
   ]
  },
  {
   "id": "r4",
   "source": "mrs-grose",
   "target": "quint",
   "weight": 5,
   "phases": [
    {
     "at": "s6",
     "type": "together",
     "label": "Appear together",
     "weight": 1,
     "note": "First named together in Ch. 6."
    }
   ]
  },
  {
   "id": "r5",
   "source": "miss-jessel",
   "target": "mrs-grose",
   "weight": 12,
   "phases": [
    {
     "at": "s7",
     "type": "together",
     "label": "Appear together",
     "weight": 1,
     "note": "First named together in Ch. 7."
    },
    {
     "at": "s21",
     "type": "together",
     "label": "Often together",
     "weight": 12
    }
   ]
  },
  {
   "id": "r6",
   "source": "miles",
   "target": "quint",
   "weight": 5,
   "phases": [
    {
     "at": "s8",
     "type": "together",
     "label": "Appear together",
     "weight": 2,
     "note": "First named together in Ch. 8."
    }
   ]
  },
  {
   "id": "r7",
   "source": "miles",
   "target": "miss-jessel",
   "weight": 7,
   "phases": [
    {
     "at": "s8",
     "type": "together",
     "label": "Appear together",
     "weight": 2,
     "note": "First named together in Ch. 8."
    }
   ]
  },
  {
   "id": "r8",
   "source": "miss-jessel",
   "target": "quint",
   "weight": 5,
   "phases": [
    {
     "at": "s8",
     "type": "together",
     "label": "Appear together",
     "weight": 3,
     "note": "First named together in Ch. 8."
    }
   ]
  },
  {
   "id": "r9",
   "source": "flora",
   "target": "quint",
   "weight": 4,
   "phases": [
    {
     "at": "s9",
     "type": "together",
     "label": "Appear together",
     "weight": 1,
     "note": "First named together in Ch. 9."
    }
   ]
  },
  {
   "id": "r10",
   "source": "flora",
   "target": "miss-jessel",
   "weight": 10,
   "phases": [
    {
     "at": "s13",
     "type": "together",
     "label": "Appear together",
     "weight": 2,
     "note": "First named together in Ch. 13."
    }
   ]
  }
 ],
 "provenance": {
  "kind": "auto-text",
  "method": "Extracted automatically from the full public-domain text. Characters are recurring names with evidence of being people; a link means two names appear in the same or adjacent paragraphs, growing stronger as they share more passages. The kind of relationship is not inferred. Expect missed nicknames, occasional duplicates (a title and a first name for one person) and the odd non-character.",
  "contributors": [
   "Character Chart auto-extractor v1"
  ],
  "createdAt": "2026-10-20",
  "updatedAt": "2026-10-20",
  "review": {
   "status": "unreviewed",
   "notes": "Generated automatically; not checked by a person."
  }
 },
 "license": "CC BY 4.0 (map data). Source text: public domain."
}
